### ISSUE TITLE
[customer] uEFI booting using dhcp relay not working

### ISSUE THREAD

**Issue by arif-ali** [xcat2/xcat-core#1222]
Hi,

I have discussed this @jjohnson42 last night, but wanted to get this to the wider xCAT community

* We have 3 management networks in the xCAT cluster VLANs 500-502
* We have xCAT MN on VLAN 502
* We have manually configured the DHCP server, similar to how xCAT does it, by changing the original dhcpd.conf generated by xCAT, to serve all the Ips through the one interface
* Configured switch to do DHCP relay on each of the VLANs to point to the xCAT MN on VLAN 502
* We have converted one machine to Legacy Boot, and the client machine is able to receive the PXE packet on VLAN 500, and do the installation
* We have reverted the machine to do uEFI boot, and we no longer seem to receive any packets
I get the following from the DHCP server, this is suggesting that it is sending the correct IP address to the client
 
```
May 26 16:55:32 admin001.domain dhcpd[27475]: DHCPDISCOVER from 40:f2:e9:c6:6b:64 via 10.28.0.2
May 26 16:55:32 admin001.domain dhcpd[27475]: DHCPOFFER on 10.28.0.21 to 40:f2:e9:c6:6b:64 via 10.28.0.2
May 26 16:55:36 admin001.domain dhcpd[27475]: DHCPDISCOVER from 40:f2:e9:c6:6b:64 via 10.28.0.2
May 26 16:55:36 admin001.domain dhcpd[27475]: DHCPOFFER on 10.28.0.21 to 40:f2:e9:c6:6b:64 via 10.28.0.2
May 26 16:55:43 admin001.domain dhcpd[27475]: DHCPDISCOVER from 40:f2:e9:c6:6b:64 via 10.28.0.2
May 26 16:55:43 admin001.domain dhcpd[27475]: DHCPOFFER on 10.28.0.21 to 40:f2:e9:c6:6b:64 via 10.28.0.2
May 26 16:56:00 admin001.domain dhcpd[27475]: DHCPDISCOVER from 40:f2:e9:c6:6b:64 via 10.28.0.2
May 26 16:56:00 admin001.domain dhcpd[27475]: DHCPOFFER on 10.28.0.21 to 40:f2:e9:c6:6b:64 via 10.28.0.2
``` 

Below are the packets in tcpdump, specific for one of these requests
 
```
17:01:05.025346 IP 0.0.0.0.bootpc > 255.255.255.255.bootps: BOOTP/DHCP, Request from 40:f2:e9:c6:6b:64 (oui Unknown),  length 347
17:01:05.026157 IP 10.28.0.2.bootps > admin001.bootps: BOOTP/DHCP, Request from 40:f2:e9:c6:6b:64 (oui Unknown), length 347
17:01:05.026289 IP admin001.bootps > 10.28.0.2.bootps: BOOTP/DHCP, Reply, length 306
17:01:05.027514 IP 10.28.0.2.bootps > 255.255.255.255.bootpc: BOOTP/DHCP, Reply, length 306
 ```

Below are some commands, to suggest, we are trying to install the machine
 
```
[root@admin001 ~]# nodeset ca011 stat
ca011: install centos7.2-x86_64-compute
[root@admin001 ~]# nodels ca011 noderes.netboot
ca011: xnba
```

Excerpt from dhcpd.leases for the node in question

```
host ca011 {
  dynamic;
  hardware ethernet 40:f2:e9:c6:6b:64;
  fixed-address 10.28.0.21;
        supersede server.next-server = 0a:1c:09:98;
        supersede server.ddns-hostname = "ca011";
        supersede host-name = "ca011";
        if option user-class-identifier = "xNBA" and option client-architecture
             = 00:00 {
          supersede server.filename =
                  "http://${next-server}/tftpboot/xcat/xnba/nodes/ca011";
        } elsif option client-architecture = 00:00 {  
          supersede server.filename = "xcat/xnba.kpxe";
        } else {
          supersede server.filename = "";
        }
}
```

Any assistance on this would be great, or if anyone has seen a similar issue in the field. The downside of going to legacy, is that I will need to re-install all the physical machines, which you can imaging would take quite a bit of time

**Comment by tingtli** [comment]
@daniceexi  @immarvin  seems Arif need the help urgent, please take a look at this problem. It seems we ever had this problem when we run NextScale test but now we don't have the test environment. @arif-ali  Is it possible that we could login your environment to take a look?

**Comment by arif-ali** [comment]
Hi @tingtli, that was great to get you to have a look. We have just fixed the issue with help from the Networking guys at the customer site. I will report back the fix, so that we can share the results

**Comment by arif-ali** [comment]
The change that was made on the Cisco switch was below

```
ip directed-broadcast
```

Not sure what this exactly entails, as I am not a network specialist, but it would be useful to understand if there is anything that can be done on the dhcpd side, to see if that can be mimic'd

**Comment by arif-ali** [comment]
OK, scratch that, that wasn't the issue

When the node get's an IP from the dynamic range, I am able to get the DHCP OFFER, and the MN is handling it, and giving the genesis image back

As soon, as it's the static lease from the dhcpd.leases, then it doesn't work. Maybe there is an option that is missing?

**Comment by arif-ali** [comment]
So, here's the issue

* We run makedhcp on ca011
* ca011 is on a different subnet of the primary interface
* xCAT MN, does not create the lease of the node, as per the makedhcp man page, after checking leases file

Therefore the leases file has the wrong information,

Right lease entry, that doesn't get created
```
host ca011 {
  dynamic;
  hardware ethernet 40:f2:e9:c6:6b:64;
  fixed-address 10.28.0.21;
        supersede server.ddns-hostname = "ca011";
        supersede host-name = "ca011";
        if option user-class-identifier = "xNBA" and option client-architecture
             = 00:00 {
          supersede server.always-broadcast = 01;
          supersede server.filename =
                  "http://${next-server}/tftpboot/xcat/xnba/nodes/ca011";
        } elsif option user-class-identifier = "xNBA" and option
                client-architecture = 00:09 {
          supersede server.filename =
                  "http://${next-server}/tftpboot/xcat/xnba/nodes/ca011.uefi";
        } elsif option client-architecture = 00:07 {
          supersede server.filename = "xcat/xnba.efi";
        } elsif option client-architecture = 00:00 {
          supersede server.filename = "xcat/xnba.kpxe";
        } else {
          supersede server.filename = "";
        }
}
```

Wrong lease information that was stored in dhcpd.leases
```
host ca011 {
  dynamic;
  hardware ethernet 40:f2:e9:c6:6b:64;
  fixed-address 10.28.0.21;
        supersede server.ddns-hostname = "ca011";
        supersede host-name = "ca011";
        if option user-class-identifier = "xNBA" and option client-architecture
             = 00:00 {
          supersede server.filename =
                  "http://${next-server}/tftpboot/xcat/xnba/nodes/ca011";
    } elsif option client-architecture = 00:00 {
          supersede server.filename = "xcat/xnba.kpxe";
        } else {
          supersede server.filename = "";
        }
}
```

So we need a way for `makedhcp <nodename>` to create the lease on the MN, if we specify the dhcpserver for the corresponding subnet in the networks table to be the MN. 

I could get this working, by writing a small script to create my leases file, but would be good to get it going through the xCAT development

I hope that makes sense

**Comment by arif-ali** [comment]
Right, problem found, I had <remote> instead of !remote! was included in the mgtifname in the networks table. Setting it to !remote! resolved the problem for us.

Apologies for all the noise

**Comment by daniceexi** [comment]
@arif-ali So it's a configuration problem. Thanks for the information.
